<?xml version="1.0" encoding="UTF-8"?>
<!-- XML Sample Message of message hierarchy                                          -->
<!-- Message:             ADC AR Cash Application v1.0 Rev. 5                         -->
<!-- Transaction:         AA - Audit Data Collection Rev. 271                         -->
<!-- Datamodel:           Audit Data Collection Datamodel, version HEAD Rev. 347      -->
<!-- XML tagset used:     AdcsML                                                      -->
<!-- Generated at:        02-05-2021 15:56:03                                         -->
<!-- Generated using:     EC-Design 2.5.0 (http://www.ec-design.nl)                   -->
<!-- Generated by:        Jan Vrijenhoek (Digitect)                                   -->
<!-- Organisation:        Digitect B.V. (Digitect)                                    -->
<!-- NOTE:    This sample message was generated automatically: manual modifications will be lost -->
<AdcArCashApplication xsi:schemaLocation="http://schemas.iso.org/AdcsML/Messages/AdcArCashApplication-v1 AdcArCashApplication.xsd"
		xmlns="http://schemas.iso.org/AdcsML/Messages/AdcArCashApplication-v1"
		xmlns:xsi="http://www.w3.org/2001/XMLSchema-instance">
	<ArCashApl>
		<ArAplId>AP1234</ArAplId>
		<FiscYr>2020</FiscYr>
		<AcntingPer>M1</AcntingPer>
		<ArAplDt>2020-02-01</ArAplDt>
		<CustAcntId>C00001</CustAcntId>
		<RcptId>RC1234</RcptId>
		<InvoiId>I001</InvoiId>
		<SetlMthdCd>SC1</SetlMthdCd>
		<Rmrk>Cash settlement</Rmrk>
		<GlDbAcntNr>ACC123456789</GlDbAcntNr>
		<GlCrAcntNr>ACC123456789</GlCrAcntNr>
		<TrAmt>
			<FuncAmt>125.1255</FuncAmt>
			<FuncCurCd>USD</FuncCurCd>
			<TrAmt>125.1255</TrAmt>
			<TrCurCd>USD</TrCurCd>
			<RprtAmt>125.1255</RprtAmt>
			<RprtCurCd>USD</RprtCurCd>
			<LocAmt>125.1255</LocAmt>
			<LocCurCd>USD</LocCurCd>
		</TrAmt>
		<Crea>
			<UserId>JD</UserId>
			<Dt>2020-03-02</Dt>
			<Tm>09:31</Tm>
		</Crea>
		<Aprv>
			<UserId>JD</UserId>
			<Dt>2020-03-02</Dt>
			<Tm>09:31</Tm>
		</Aprv>
		<LstMdf>
			<UserId>JD</UserId>
			<Dt>2020-03-02</Dt>
			<Tm>09:31</Tm>
		</LstMdf>
		<BusSg>
			<BusSgCd>1234</BusSgCd>
		</BusSg>
	</ArCashApl>
</AdcArCashApplication>
